title,slug,section,category,primaryKeyword,secondaryKeywords,parentArticle,parentCalculator,articleType,priorityScore,wordCount,macroContext,microContext
"How to Diversify TikTok Income Streams",diversify-tiktok-income-streams,core,guides/monetization,diversify tiktok income,"multiple income streams tiktok;tiktok revenue diversification",/guides/monetization,/calculators/tiktok-money,informative,86,2500,Building multiple revenue channels as a TikTok creator,"creator fund;brand deals;shop;digital products;cross-platform"
"Selling Digital Products Through TikTok",selling-digital-products-tiktok,core,guides/monetization,sell digital products tiktok,"tiktok digital product sales;ebooks tiktok;templates tiktok",/guides/monetization,,informative,84,2500,Guide to selling digital products using TikTok as a sales channel,"ebooks;templates;courses;presets;link in bio;funnel"
"TikTok Monetization by Country — Which Countries Pay Best",tiktok-monetization-by-country,core,guides/monetization,tiktok monetization by country,"best countries tiktok earnings;tiktok pay by country",/guides/monetization,/calculators/tiktok-money,data,88,2500,TikTok creator payment rates and program availability by country,"tier 1;tier 2;creator fund availability;RPM comparison"
"TikTok Affiliate Marketing Without TikTok Shop",tiktok-affiliate-without-shop,core,guides/monetization,tiktok affiliate marketing,"affiliate marketing tiktok;tiktok link in bio affiliate",/guides/monetization,,informative,83,2000,Non-Shop affiliate monetization strategies for TikTok creators,"Amazon;ShareASale;Impact;link in bio;content strategy"
"How to Get Paid Faster on TikTok",get-paid-faster-tiktok,core,guides/monetization,tiktok payment speed,"faster tiktok payouts;tiktok withdrawal tips",/guides/monetization,,informative,82,1500,Tips for accelerating TikTok creator payment processing,"withdrawal methods;minimum thresholds;payment schedule;country"
"Financial Planning for TikTok Creators",financial-planning-tiktok-creators,core,guides/monetization,tiktok creator financial planning,"creator finances;tiktok income budgeting",/guides/monetization,,informative,81,2500,Financial planning and budgeting guide for TikTok creators,"irregular income;savings;taxes;retirement;emergency fund"
"TikTok Analytics Dashboard — Complete Guide",tiktok-analytics-guide,core,guides/growth,tiktok analytics dashboard,"tiktok analytics explained;tiktok insights guide",/guides/growth,,informative,88,2500,Complete guide to understanding and using TikTok analytics,"metrics;KPIs;audience data;content performance;trends"
"How to Get on TikTok For You Page Consistently",get-on-fyp-consistently,core,guides/growth,get on tiktok for you page,"tiktok FYP tips;for you page algorithm",/guides/growth,,informative,90,2500,Proven strategies for consistent TikTok For You Page placement,"algorithm signals;content patterns;engagement triggers;timing"
"TikTok Content Pillars — Planning Your Content Mix",tiktok-content-pillars,core,guides/growth,tiktok content pillars,"content strategy tiktok;content mix planning",/guides/growth,,informative,84,2000,Building a sustainable TikTok content strategy with content pillars,"education;entertainment;inspiration;promotion;ratio"
"How to Repurpose TikTok Content Across Platforms",repurpose-tiktok-content,core,guides/growth,repurpose tiktok content,"tiktok to youtube shorts;tiktok to reels",/guides/growth,/calculators/multi-platform-earnings,informative,83,2000,Maximizing content ROI by repurposing TikTok videos across platforms,"youtube shorts;instagram reels;pinterest;watermark removal"
"TikTok Batch Content Creation — Productivity System",tiktok-batch-content-creation,core,guides/growth,tiktok batch content creation,"content creation workflow;tiktok productivity",/guides/growth,,informative,82,2000,Efficient batch filming and editing workflow for TikTok creators,"batch filming;editing workflow;content calendar;tools"
"TikTok Sounds and Music — How They Affect Distribution",tiktok-sounds-music-distribution,core,guides/growth,tiktok sounds algorithm,"trending sounds tiktok;music effect on reach",/guides/growth,,informative,83,2000,How sound and music choices impact TikTok video distribution,"trending audio;original audio;commercial music;algorithm boost"
"FTC Disclosure Requirements for TikTok Creators",ftc-disclosure-tiktok,core,guides/business,tiktok ftc disclosure,"sponsored content disclosure;tiktok ad disclosure",/guides/business,,informative,86,2000,FTC and advertising disclosure rules for TikTok sponsored content,"hashtags;verbal disclosure;placement;penalties;international"
"Copyright and Fair Use on TikTok Explained",tiktok-copyright-fair-use,core,guides/business,tiktok copyright,"fair use tiktok;tiktok copyright claim",/guides/business,,informative,84,2000,Understanding copyright and fair use protections on TikTok,"music;video clips;DMCA;appeals;original content"
"TikTok Community Guidelines — Avoiding Strikes and Bans",tiktok-community-guidelines-strikes,core,guides/business,tiktok community guidelines,"tiktok strikes;tiktok ban reasons",/guides/business,,informative,85,2000,TikTok community guidelines enforcement and account safety,"violations;strikes;appeals;permanent ban;reinstatement"
"Pet TikTok — Monetization Beyond Cute Videos",pet-tiktok-monetization,core,guides/niches,pet tiktok earnings,"pet influencer income;animal tiktok money",/guides/niches,/calculators/niche-profitability,data,82,2000,Monetization strategies and earnings data for pet content on TikTok,"brand deals;affiliate;merch;pet products;RPM"
"Travel TikTok — Earnings and Sponsorship Rates",travel-tiktok-earnings,core,guides/niches,travel tiktok earnings,"travel influencer income;travel brand deals",/guides/niches,/calculators/niche-profitability,data,82,2000,Travel niche TikTok earnings breakdown and sponsorship rate data,"tourism boards;hotel deals;RPM;brand rates;content types"
"Tech TikTok — Highest RPM Niche Analysis",tech-tiktok-earnings,core,guides/niches,tech tiktok earnings,"tech reviewer income tiktok;tech niche rpm",/guides/niches,/calculators/niche-profitability,data,83,2000,Why tech is TikTok's highest-RPM niche and how to monetize it,"advertiser demand;RPM rates;brand deals;affiliate;review content"
