title,slug,section,category,primaryKeyword,secondaryKeywords,parentArticle,parentCalculator,articleType,priorityScore,wordCount,macroContext,microContext
"TikTok Algorithm Update March 2026 — What Changed for Creators",tiktok-algorithm-update-march-2026,outer,blog,tiktok algorithm update 2026,"tiktok algorithm changes;new algorithm tiktok",/guides/growth/tiktok-algorithm-explained,,informative,85,2000,Latest TikTok algorithm changes and their impact on creator reach,"ranking factors;distribution changes;content recommendations"
"TikTok Creator Rewards Payout Rates Update 2026",creator-rewards-payout-update-2026,outer,blog,tiktok creator rewards rates 2026,"creator rewards payout;tiktok RPM update",/calculators/tiktok-creator-fund,/calculators/tiktok-creator-fund,informative,86,1500,Latest payout rate data from TikTok Creator Rewards Program,"RPM changes;country rates;eligibility updates"
"Q1 2026 TikTok RPM Report — How Creator Earnings Performed",q1-2026-tiktok-rpm-report,outer,blog,tiktok rpm q1 2026,"quarterly earnings report;tiktok creator fund Q1",/data/earnings,/calculators/rpm,data,84,2000,Analysis of TikTok creator RPM rates for Q1 2026,"by niche;by country;vs Q4;trends;advertiser spend"
"TikTok Ban Update 2026 — Current Status and Creator Impact",tiktok-ban-status-2026,outer,blog,tiktok ban update 2026,"tiktok ban status;is tiktok getting banned",/blog,,informative,88,2000,Current status of TikTok ban legislation and implications for creators,"timeline;legal status;creator impact;contingency planning"
"TikTok Shop Expansion Update — New Countries and Features",tiktok-shop-expansion-2026,outer,blog,tiktok shop expansion 2026,"tiktok shop new countries;tiktok shop update",/guides/monetization,/calculators/commerce-ads/shop-profit,informative,83,1500,Latest TikTok Shop geographic expansion and feature updates,"new markets;seller features;commission changes;GMV growth"
"How Charli D'Amelio Makes Money on TikTok — Earnings Breakdown",charli-damelio-tiktok-earnings,outer,blog,charli damelio earnings,"charli damelio income;charli damelio net worth tiktok",/data/earnings,/calculators/tiktok-money,informative,87,2000,Estimated earnings breakdown of Charli D'Amelio's TikTok income,"brand deals;businesses;creator fund;live;merchandise"
"How Khaby Lame Makes Money on TikTok — Earnings Breakdown",khaby-lame-tiktok-earnings,outer,blog,khaby lame earnings,"khaby lame income;khaby lame tiktok money",/data/earnings,/calculators/tiktok-money,informative,87,2000,Estimated earnings breakdown of Khaby Lame's TikTok empire,"brand deals;international reach;creator rewards;merchandise"
"Spring 2026 TikTok Trends — What Is Going Viral Right Now",spring-2026-tiktok-trends,outer,blog,tiktok trends 2026,"trending tiktok;whats viral on tiktok",/guides/growth,,informative,80,1500,Current TikTok content trends and viral formats for spring 2026,"sounds;formats;challenges;aesthetic;niches"
"TikTok New Feature Roundup — Everything Launched in 2026",tiktok-new-features-2026,outer,blog,tiktok new features 2026,"tiktok updates 2026;new tiktok features",/blog,,informative,82,2000,Comprehensive roundup of TikTok features and updates launched in 2026,"creator tools;monetization;search;editing;AI features"
"5 TikTok Creators Who Quit Their Jobs — Income Reports",tiktok-creators-quit-jobs-income,outer,blog,tiktok creators full time income,"full time tiktok creator;quit job for tiktok",/guides/monetization,/calculators/tiktok-money,informative,85,2500,Real income reports from creators who went full-time on TikTok,"timeline;income breakdown;challenges;advice;milestones"
"TikTok Spark Ads Update — What Changed for Creators",tiktok-spark-ads-update-2026,outer,blog,tiktok spark ads 2026,"spark ads changes;tiktok creator ads",/guides/monetization,,informative,81,1500,Latest changes to TikTok Spark Ads and how they affect creator earnings,"whitelisting;payout;authorization;optimization"
"Is TikTok Creator Fund Worth It in 2026",tiktok-creator-fund-worth-it-2026,outer,blog,is tiktok creator fund worth it,"creator fund review;creator fund vs rewards",/calculators/tiktok-creator-fund,/calculators/tiktok-creator-fund,informative,84,2000,Analysis of whether TikTok Creator Fund is still worth joining in 2026,"RPM rates;vs alternatives;opportunity cost;who should join"
"Best TikTok Niches for Making Money in 2026",best-tiktok-niches-money-2026,outer,blog,best tiktok niches 2026,"most profitable tiktok niches;tiktok niche ideas",/guides/niches,/calculators/niche-profitability,data,86,2500,Data-driven ranking of the most profitable TikTok niches in 2026,"RPM;brand deals;growth;competition;opportunity"
"How the TikTok Algorithm Changed in 2026 — Creator Impact",tiktok-algorithm-changes-2026-roundup,outer,blog,tiktok algorithm changes 2026,"algorithm update tiktok;tiktok reach changes",/guides/growth/tiktok-algorithm-explained,,informative,84,2000,Summary of all TikTok algorithm changes in 2026 and creator strategies,"retention focus;search priority;content diversity;recommendations"
"TikTok Holiday Season Strategy — Maximizing Q2 Earnings",tiktok-holiday-strategy-q2,outer,blog,tiktok summer strategy,"tiktok seasonal content;summer tiktok earnings",/guides/monetization,/calculators/rpm,informative,79,1500,Seasonal content and monetization strategy for TikTok creators in Q2,"trending topics;advertiser budgets;RPM trends;content calendar"
